{
  "schema_version": "hsie-world-reference/0.1",
  "representation_id": "representation:lagoon-exterior-360-v1",
  "place_ref": "place:lagoon-cuts-demo",
  "space_ref": "exterior",
  "representation_type": "PANORAMA_360",
  "asset_ref": "scenes/lagoon-exterior.jpg",
  "projection": "equirectangular",
  "renderer_adapter": "pannellum-360",
  "version": 1,
  "status": "EXISTING_SAMPLE_REFERENCE",
  "integrity_digest": "git-blob-sha1:8458a36e613ee5fe5e911e77d82e802364b838f0",
  "legacy_refs": [
    "lagoon-exterior",
    "scenes/lagoon-exterior.jpg"
  ]
}
